{
  "items": [
    {
      "collection": "bytedance-products",
      "display_name": "doubao",
      "id": "bytedance-products-doubao",
      "kind": "icon",
      "mime": "image/png",
      "path": "assets/shared/bytedance-products/doubao.png",
      "sha256": "4303fa608066ee294c851514fe1f1aa83d7f49615a11b48de5518487f51bafd3",
      "size_bytes": 2470,
      "tags": [
        "bytedance-products",
        "doubao",
        "icon"
      ]
    },
    {
      "collection": "bytedance-products",
      "display_name": "trae",
      "id": "bytedance-products-trae",
      "kind": "icon",
      "mime": "image/png",
      "path": "assets/shared/bytedance-products/trae.png",
      "sha256": "f6b871ee270d2f3722e4054489c61f34fa4296045b191068e7590551c4bd1e6b",
      "size_bytes": 8293,
      "tags": [
        "bytedance-products",
        "icon",
        "trae"
      ]
    },
    {
      "collection": "clientlogo",
      "display_name": "Babycare",
      "id": "clientlogo-babycare",
      "kind": "logo",
      "mime": "image/png",
      "path": "assets/shared/clientlogo/Babycare.png",
      "sha256": "5549e8515eb50deb7ef88e3254120117312e25889e3a87a70eb418cf963abe7b",
      "size_bytes": 12147,
      "tags": [
        "Babycare",
        "clientlogo",
        "logo"
      ]
    },
    {
      "collection": "clientlogo",
      "display_name": "Cabana家具",
      "id": "clientlogo-cabana家具",
      "kind": "logo",
      "mime": "image/png",
      "path": "assets/shared/clientlogo/Cabana家具.png",
      "sha256": "22cf84d8098dd4174b676e0fca1f765331bdfe3b539a220ea2084f0bfe5c63e1",
      "size_bytes": 9336,
      "tags": [
        "Cabana家具",
        "clientlogo",
        "logo"
      ]
    },
    {
      "collection": "clientlogo",
      "display_name": "CPE源峰",
      "id": "clientlogo-cpe源峰",
      "kind": "logo",
      "mime": "image/png",
      "path": "assets/shared/clientlogo/CPE源峰.png",
      "sha256": "0004d767cbe4370c472485ad6b2a902953739e9d36c10be07e9870f8244807e2",
      "size_bytes": 72616,
      "tags": [
        "CPE源峰",
        "clientlogo",
        "logo"
      ]
    },
    {
      "collection": "clientlogo",
      "display_name": "CPE源峰_paired",
      "id": "clientlogo-cpe源峰_paired",
      "kind": "logo",
      "mime": "image/png",
      "path": "assets/shared/clientlogo/CPE源峰_paired.png",
      "sha256": "3d18647da63c10ae8c630409c7442668f6675e5e2117d5c8331bfe8bab3edebf",
      "size_bytes": 27044,
      "tags": [
        "CPE源峰",
        "clientlogo",
        "logo",
        "paired"
      ]
    },
    {
      "collection": "clientlogo",
      "display_name": "ELLASSAY_歌力思",
      "id": "clientlogo-ellassay_歌力思",
      "kind": "logo",
      "mime": "image/png",
      "path": "assets/shared/clientlogo/ELLASSAY_歌力思.png",
      "sha256": "068364a7af516adb4872dc9735866579f284ed53fe4e745d3ba02959c77b108c",
      "size_bytes": 11175,
      "tags": [
        "ELLASSAY",
        "clientlogo",
        "logo",
        "歌力思"
      ]
    },
    {
      "collection": "clientlogo",
      "display_name": "HBN颜究所",
      "id": "clientlogo-hbn颜究所",
      "kind": "logo",
      "mime": "image/png",
      "path": "assets/shared/clientlogo/HBN颜究所.png",
      "sha256": "829e49772315d7717ddd5e3bcc36103a09c486447b5fd9a74e422c5d7ed31f06",
      "size_bytes": 134976,
      "tags": [
        "HBN颜究所",
        "clientlogo",
        "logo"
      ]
    },
    {
      "collection": "clientlogo",
      "display_name": "HitGoo",
      "id": "clientlogo-hitgoo",
      "kind": "logo",
      "mime": "image/png",
      "path": "assets/shared/clientlogo/HitGoo.png",
      "sha256": "d34474d6b5330f3f5cba4ef45a0071de638190825478a871b61eb09c63491892",
      "size_bytes": 159641,
      "tags": [
        "HitGoo",
        "clientlogo",
        "logo"
      ]
    },
    {
      "collection": "clientlogo",
      "display_name": "IDG资本",
      "id": "clientlogo-idg资本",
      "kind": "logo",
      "mime": "image/png",
      "path": "assets/shared/clientlogo/IDG资本.png",
      "sha256": "5a81a3ddc62f491408731c8511fb60a152d715f9b93fe001b11db8a5b5a53481",
      "size_bytes": 20034,
      "tags": [
        "IDG资本",
        "clientlogo",
        "logo"
      ]
    },
    {
      "collection": "clientlogo",
      "display_name": "JACK_JONES_杰克琼斯",
      "id": "clientlogo-jack_jones_杰克琼斯",
      "kind": "logo",
      "mime": "image/png",
      "path": "assets/shared/clientlogo/JACK_JONES_杰克琼斯.png",
      "sha256": "f4bafa85cd7633d4f3618e9b92db8ac3895de33dab7df16a79713b1954109b0a",
      "size_bytes": 126340,
      "tags": [
        "JACK",
        "JONES",
        "clientlogo",
        "logo",
        "杰克琼斯"
      ]
    },
    {
      "collection": "clientlogo",
      "display_name": "Kappa中国",
      "id": "clientlogo-kappa中国",
      "kind": "logo",
      "mime": "image/png",
      "path": "assets/shared/clientlogo/Kappa中国.png",
      "sha256": "2a05f3b6d78b8dc757ad5eab45235cfdb0e5cbc4f2bba98bc9cd8159d91ed62d",
      "size_bytes": 127000,
      "tags": [
        "Kappa中国",
        "clientlogo",
        "logo"
      ]
    },
    {
      "collection": "clientlogo",
      "display_name": "Karl Lagerfeld",
      "id": "clientlogo-karl-lagerfeld",
      "kind": "logo",
      "mime": "image/png",
      "path": "assets/shared/clientlogo/Karl Lagerfeld.png",
      "sha256": "ae611cff41ac936de8661e8ad6fbb94b50473f2291840278fb7ac14eb91ff842",
      "size_bytes": 216906,
      "tags": [
        "Karl",
        "Lagerfeld",
        "clientlogo",
        "logo"
      ]
    },
    {
      "collection": "clientlogo",
      "display_name": "KKR",
      "id": "clientlogo-kkr",
      "kind": "logo",
      "mime": "image/png",
      "path": "assets/shared/clientlogo/KKR.png",
      "sha256": "0a3ce5921bf358a4552546f16ec8f26099dce6476c34b4a177198f8ce9a925d4",
      "size_bytes": 172589,
      "tags": [
        "KKR",
        "clientlogo",
        "logo"
      ]
    },
    {
      "collection": "clientlogo",
      "display_name": "LINLEE",
      "id": "clientlogo-linlee",
      "kind": "logo",
      "mime": "image/png",
      "path": "assets/shared/clientlogo/LINLEE.png",
      "sha256": "c2a7e9521ffd01e8c6e1f6a96ccd5f943463a2a4d042e54e00fbea243dce7071",
      "size_bytes": 367978,
      "tags": [
        "LINLEE",
        "clientlogo",
        "logo"
      ]
    },
    {
      "collection": "clientlogo",
      "display_name": "Mistine_1",
      "id": "clientlogo-mistine_1",
      "kind": "logo",
      "mime": "image/png",
      "path": "assets/shared/clientlogo/Mistine_1.png",
      "sha256": "9e776c341de38a5d145f096d012db9df7564d77a741b4217ac3209fcedd57cfe",
      "size_bytes": 37039,
      "tags": [
        "1",
        "Mistine",
        "clientlogo",
        "logo"
      ]
    },
    {
      "collection": "clientlogo",
      "display_name": "Mistine_2",
      "id": "clientlogo-mistine_2",
      "kind": "logo",
      "mime": "image/png",
      "path": "assets/shared/clientlogo/Mistine_2.png",
      "sha256": "6583b50fc17b8c064f9928ded30256370d3056599743e9e78191e9b56a75738a",
      "size_bytes": 36976,
      "tags": [
        "2",
        "Mistine",
        "clientlogo",
        "logo"
      ]
    },
    {
      "collection": "clientlogo",
      "display_name": "moodytiger",
      "id": "clientlogo-moodytiger",
      "kind": "logo",
      "mime": "image/png",
      "path": "assets/shared/clientlogo/moodytiger.png",
      "sha256": "5da01da76f4abbe1cd5636466ee7e49dbdb1e4fbf4ab7bbd86dcd15dfe36598a",
      "size_bytes": 108843,
      "tags": [
        "clientlogo",
        "logo",
        "moodytiger"
      ]
    },
    {
      "collection": "clientlogo",
      "display_name": "PAG",
      "id": "clientlogo-pag",
      "kind": "logo",
      "mime": "image/png",
      "path": "assets/shared/clientlogo/PAG.png",
      "sha256": "b18bb8247729ea61bcc900f6ea7e48c7e3b7b6abdc83850482d72ef49e304466",
      "size_bytes": 37535,
      "tags": [
        "PAG",
        "clientlogo",
        "logo"
      ]
    },
    {
      "collection": "clientlogo",
      "display_name": "PEAK_匹克",
      "id": "clientlogo-peak_匹克",
      "kind": "logo",
      "mime": "image/png",
      "path": "assets/shared/clientlogo/PEAK_匹克.png",
      "sha256": "e0035adb9acc14a942437e2e10b768a0a4b38f4a2f85cd1be456ee466b26009e",
      "size_bytes": 130324,
      "tags": [
        "PEAK",
        "clientlogo",
        "logo",
        "匹克"
      ]
    },
    {
      "collection": "clientlogo",
      "display_name": "RPS",
      "id": "clientlogo-rps",
      "kind": "logo",
      "mime": "image/png",
      "path": "assets/shared/clientlogo/RPS.png",
      "sha256": "83374137b87965868882a02b95ea206914bdb6e08c98a3acaf08e1778d02c0ca",
      "size_bytes": 96742,
      "tags": [
        "RPS",
        "clientlogo",
        "logo"
      ]
    },
    {
      "collection": "clientlogo",
      "display_name": "Toys _R_ Us",
      "id": "clientlogo-toys-_r_-us",
      "kind": "logo",
      "mime": "image/png",
      "path": "assets/shared/clientlogo/Toys _R_ Us.png",
      "sha256": "fa318d7d3e93207ea778dc2e527c38a153ec06a6eb0c1f01a28852da861c9e15",
      "size_bytes": 200341,
      "tags": [
        "R",
        "Toys",
        "Us",
        "clientlogo",
        "logo"
      ]
    },
    {
      "collection": "clientlogo",
      "display_name": "ubras",
      "id": "clientlogo-ubras",
      "kind": "logo",
      "mime": "image/png",
      "path": "assets/shared/clientlogo/ubras.png",
      "sha256": "f094039dc67f3db517ffff319ae6982c505c81483e811d774a23816c3928b23d",
      "size_bytes": 90400,
      "tags": [
        "clientlogo",
        "logo",
        "ubras"
      ]
    },
    {
      "collection": "clientlogo",
      "display_name": "七匹狼",
      "id": "clientlogo-七匹狼",
      "kind": "logo",
      "mime": "image/png",
      "path": "assets/shared/clientlogo/七匹狼.png",
      "sha256": "ae611cff41ac936de8661e8ad6fbb94b50473f2291840278fb7ac14eb91ff842",
      "size_bytes": 216906,
      "tags": [
        "clientlogo",
        "logo",